{"$schema":"https://json-schema.org/draft/2020-12/schema","$id":"https://schemas.rotprods.dev/clever/v1/action-intent.schema.json","type":"object","additionalProperties":false,"required":["contractVersion","actionId","idempotencyKey","principal","capabilityId","operation","sideEffectClass","policyDecisionId","payload","requestedAt"],"properties":{"contractVersion":{"$ref":"https://schemas.rotprods.dev/clever/v1/common.schema.json#/$defs/contractVersion"},"actionId":{"type":"string","minLength":1},"idempotencyKey":{"type":"string","minLength":1},"principal":{"$ref":"https://schemas.rotprods.dev/clever/v1/common.schema.json#/$defs/principalRef"},"sessionId":{"type":"string"},"goalId":{"type":"string"},"capabilityId":{"type":"string","minLength":1},"operation":{"type":"string","minLength":1},"sideEffectClass":{"type":"string","enum":["SIDE_EFFECT_CLASS_READ_ONLY","SIDE_EFFECT_CLASS_REVERSIBLE_LOCAL","SIDE_EFFECT_CLASS_EXTERNAL_MUTATION","SIDE_EFFECT_CLASS_DESTRUCTIVE"]},"policyDecisionId":{"type":"string","minLength":1},"payload":{"$ref":"https://schemas.rotprods.dev/clever/v1/common.schema.json#/$defs/payload"},"requestedAt":{"$ref":"https://schemas.rotprods.dev/clever/v1/common.schema.json#/$defs/timestamp"}}}
