{"contractVersion":{"major":1,"minor":0},"actionId":"act_demo","idempotencyKey":"idem_demo","principal":{"userId":"user_demo","deviceId":"mac_demo"},"sessionId":"ses_demo","goalId":"goal_demo","capabilityId":"computer.file.write","operation":"write","sideEffectClass":"SIDE_EFFECT_CLASS_EXTERNAL_MUTATION","policyDecisionId":"pol_demo","payload":{"schemaUri":"clever://actions/file-write/v1","contentType":"application/json","data":"e30="},"requestedAt":"2026-09-01T00:00:00Z"}
